{
  "schema_version": "open_vsx_public_state_observation.v1",
  "observed_at": "2026-08-14T09:12:00Z",
  "registry": "open_vsx",
  "identity": {
    "namespace": "EffortlessMetrics",
    "extension": "perl-lsp-rs"
  },
  "instrument": {
    "name": "open-vsx-public-state-fixture",
    "version": "1",
    "source_ref": "#9923"
  },
  "expected": {
    "versions": [
      {
        "version": "0.17.0",
        "vsix_sha256": null
      }
    ],
    "publication_refs": [
      "https://github.com/EffortlessMetrics/perl-lsp-swarm/actions/runs/0000000000",
      "Publish VSCode Extension / Publish Open VSX (2026-06-28) reported success"
    ]
  },
  "cells": {
    "listing": {
      "transport": {
        "url": "https://open-vsx.org/extension/EffortlessMetrics/perl-lsp-rs",
        "method": "GET",
        "outcome": "http_response",
        "status": 404,
        "redirects": 0,
        "response_bytes": 1024,
        "truncated": false,
        "error_kind": null
      }
    },
    "search": {
      "transport": {
        "url": "https://open-vsx.org/api/-/search?query=perl-lsp-rs&size=50",
        "method": "GET",
        "outcome": "http_response",
        "status": 200,
        "redirects": 0,
        "response_bytes": 2048,
        "truncated": false,
        "error_kind": null
      },
      "matched_identity": false
    },
    "namespace_metadata": {
      "transport": {
        "url": "https://open-vsx.org/api/EffortlessMetrics",
        "method": "GET",
        "outcome": "http_response",
        "status": 200,
        "redirects": 0,
        "response_bytes": 512,
        "truncated": false,
        "error_kind": null
      },
      "namespace_present": true
    },
    "extension_metadata": {
      "transport": {
        "url": "https://open-vsx.org/api/EffortlessMetrics/perl-lsp-rs",
        "method": "GET",
        "outcome": "http_response",
        "status": 404,
        "redirects": 0,
        "response_bytes": 64,
        "truncated": false,
        "error_kind": null
      },
      "identity_matches": null,
      "versions": null
    },
    "version_rows": {
      "transport": {
        "url": "https://open-vsx.org/api/EffortlessMetrics/perl-lsp-rs/versions",
        "method": "GET",
        "outcome": "http_response",
        "status": 404,
        "redirects": 0,
        "response_bytes": 64,
        "truncated": false,
        "error_kind": null
      },
      "versions": null
    },
    "versioned_file": {
      "transport": {
        "url": "https://open-vsx.org/api/EffortlessMetrics/perl-lsp-rs/0.17.0/file/EffortlessMetrics.perl-lsp-rs-0.17.0.vsix",
        "method": "GET",
        "outcome": "http_response",
        "status": 429,
        "redirects": 0,
        "response_bytes": 128,
        "truncated": false,
        "error_kind": "rate_limited"
      },
      "version": null,
      "sha256": null,
      "byte_length": null
    }
  }
}
